theme,question,answer,reference
フェルマーの最終定理,フェルマーの最終定理とは何でしょう？,"3 以上の自然数 n について、xn + yn = zn となる自然数の組 (x, y, z) は存在しない"," 「フェルマーの最終定理（フェルマーのさいしゅうていり、英: Fermat's Last Theorem）とは、3 以上の自然数 n について、xn + yn = zn となる自然数の組 (x, y, z) は存在しない、という定理である。フェルマーの大定理とも呼ばれる。ピエール・ド・フェルマーが「驚くべき証明を得た」と書き残したと伝えられ、長らく証明も反証もなされなかったことからフェルマー予想とも称されたが、フェルマーの死後330年経った1995年にアンドリュー・ワイルズによって完全に証明され、ワイルズの定理またはフェルマー・ワイルズの定理とも呼ばれるようになった。」

 「3 以上の自然数 n について、xn + yn = zn となる自然数の組 (x, y, z) は存在しない」"
カーボンニュートラル,,,カーボンニュートラル（carbon neutrality）とは、二酸化炭素など温室効果ガスの排出量と吸収量を均衡させ、その排出量を「実質ゼロ」に抑える概念。カーボンニュートラルの実現には、1.排出分の吸収、2.排出量の削減、3.排出量取引、の三つの手法がとられる。
藤井聡太,最年少でプロ入りし、将棋界に革命を起こした日本の将棋棋士は誰でしょう？,藤井聡太,藤井 聡太は、日本の将棋棋士であり、プロ入り前の棋歴や奨励会時代などで活躍していました。最年少でプロ入りし、その後の活躍で多くの最年少記録を塗り替えるなど、将棋界に革命を起こしました。
灰原哀,江戸川コナンと同じく帝丹小学校1年に編入し、少年探偵団に入団した架空の人物は誰でしょう？,灰原哀,灰原哀（はいばら あい）は、『週刊少年サンデー』で連載されている青山剛昌原作の漫画作品、およびそれを原作とするテレビアニメなどのメディアミックス作品群『名探偵コナン』の作品に登場する架空の人物である。それ以降は正体の露見を防ぐため、灰原哀と名乗って江戸川コナンと同じく帝丹小学校1年に編入するが、少年探偵団には半ば強引に入団させられた。
徳川家康,,,徳川 家康は、室町時代後期から江戸時代初期の日本の武将、戦国大名。江戸幕府初代征夷大将軍。三英傑の1人である。
フランス革命,フランス革命を日本語で何と言うでしょう？,フランスかくめい,"フランス革命（フランスかくめい、仏: Révolution française, 英: French Revolution ）とは、フランス王国で1789年7月14日から1795年8月22日にかけて起きたブルジョア革命。フランス革命記念日（パリ祭）はフランス共和国の建国記念日でもあり、毎年7月14日に祝われている。
フランス革命を代表とするブルジョア革命は、封建的な残留物（身分制や領主制）を一掃し、

フランス革命はアメリカ独立革命とともに、ブルジョア革命の典型的事例である。"
7,7は、自然数または整数において、6の次で8の前の数であり、4番目の素数です。では、この数は何でしょう？,7,7は、自然数また整数において、6の次で8の前の数である。7は4番目の素数である。
屋久島,「屋久島」とは、鹿児島県の大隅半島佐多岬南南西約60kmの海上に位置する島で、九州最高峰の山、宮之浦岳（標高1936m）があります。自然が豊かで、屋久島国立公園の中核をなし、世界自然遺産の一つに登録されている、鹿児島県にある島は何でしょう？,屋久島,"屋久島（やくしま）は、鹿児島県の大隅半島佐多岬南南西約60kmの海上に位置する島。熊毛郡屋久島町に属し、近隣の種子島や口永良部島などと共に大隅諸島を形成する。南方に位置するトカラ列島や奄美群島などとともに南西諸島を構成する。
九州最高峰の山、宮之浦岳（標高1936m）がある。自然が豊かで、屋久島国立公園の中核をなし、世界自然遺産の一つに登録されている。熊毛郡屋久島町に属し、近隣の種子島や口永良部島などと共に大隅諸島を形成する。"
旭川市旭山動物園,北海道旭川市東旭川町倉沼にある動物園で、日本最北の動物園であり、北海道を代表する観光地である。行動展示や混合展示など、斬新な展示方法を取り入れており、国内外の動物園関係者からも注目されている。寒冷地に生息する動物の飼育繁殖に実績があり、ホッキョクグマやアムールヒョウなどがいる。ゾウの多頭飼育を検討している。旭川市旭山動物園の通称は何でしょう？,旭山動物園,旭川市旭山動物園は北海道旭川市東旭川町倉沼にある動物園で、通称は旭山動物園。日本最北の動物園であり、北海道を代表する観光地である。行動展示や混合展示など、斬新な展示方法を取り入れており、国内外の動物園関係者からも注目されている。寒冷地に生息する動物の飼育繁殖に実績があり、ホッキョクグマやアムールヒョウなどがいる。ゾウの多頭飼育を検討している。旭川市旭山動物園の通称は何でしょう？
サハラ砂漠,アフリカ大陸北部に広がる、世界最大級の砂漠は何でしょう？,サハラ砂漠,"サハラ砂漠（サハラさばく、الصحراء الكبرى‎）または単にサハラ は、アフリカ大陸北部にある砂漠で、氷雪気候の南極を除くと世界最大級の砂漠である。面積は約1,000万平方キロメートルであり、アフリカ大陸の3分の1近くを占め、アメリカ合衆国とほぼ同じ面積である。"
セブン-イレブン,日本のコンビニエンスストアチェーンで、セブン&アイ・ホールディングスの完全子会社である、店舗数が最も多く、機会ロスの最小化を徹底して行い、顧客の購入機会を最大化する経営手法を採用しているのは、何でしょう？,セブン-イレブン,"セブン-イレブン・ジャパンは、日本のコンビニエンスストアチェーンであり、セブン&アイ・ホールディングスの完全子会社です。セブン-イレブンは、日本のコンビニエンスストアとしては最大手であり、世界でも最大の店舗数を展開しています。

セブン-イレブンは、日本で最大の店舗数を持つコンビニエンスストアです。また、機会ロスの最小化を徹底して行い、顧客のニーズをいち早く察知し、売れ残ることなく顧客の購入機会を最大化する経営手法を採用しています。また、日本国内ではドミナント戦略を展開し、特定の地域へ集中的に出店することで効率を向上させています。さらに、全国に20,904店舗を展開し、1店舗あたりの販売額が最大であることでも知られています。"
ホールインワン,ゴルフ競技において1打目でカップにボールを入れることを何と言うでしょう？,ホールインワン,ホールインワン（英語: Hole in one）とは、ゴルフ競技において1打目でカップにボールを入れること。ホールインワンもゴルフの通常ルールにおけるカップインの定義が適用される。
ノストラダムス,,,ミシェル・ノストラダムスは、ルネサンス期フランスの医師、占星術師、詩人であり、料理研究の著作も著している。彼の予言は、現在に至るまで非常に多くの信奉者を生み出し、様々な論争を引き起こしている。
自動販売機,,,自動販売機とは、不特定多数の人間が通貨（貨幣）もしくはそれに代替するカードなどを投入して対価を払うことで自動で商品（物品）の購入やサービスの提供を受けることができるようにした機器。自動販売機は、お金を支払うと（たとえば、現金や電子マネーのカードをタッチするなどして）押しボタン操作などをすることにより、自動的に商品（物品や情報やサービス）を購入することができる機械である。
ChatGPT,,,ChatGPTは、OpenAIが2022年11月に公開した人工知能チャットボットであり、生成AIの一種。ChatGPTはGPT-3ファミリーの大規模な言語モデルに基づいて構築されており、教師あり学習と強化学習の両方の手法を使って転移学習され、機械学習のサブセットである深層学習を使って開発されている。
RRR (映画),2022年に公開されたインドのテルグ語叙事詩的ミュージカルアクション映画『RRR』で監督・脚本を務めたのは誰でしょう？,S・S・ラージャマウリ,『RRR』（アールアールアール、原題: RRR）は、2022年のインドのテルグ語叙事詩的ミュージカルアクション映画。監督・脚本はS・S・ラージャマウリが務め、N・T・ラーマ・ラオ・ジュニア、ラーム・チャラン、アジャイ・デーヴガン、アーリヤー・バット、シュリヤ・サラン、サムドラカニ、レイ・スティーヴンソン、アリソン・ドゥーディ、オリヴィア・モリスが出演している。物語は実在の独立運動指導者コムラム・ビームとアッルーリ・シータラーマ・ラージュを主人公としたフィクションであり、2人が歴史上に登場する以前の空白の時代を舞台にし、2人がイギリス領インド帝国に戦いを挑む姿を描いている。
おにぎり,日本の伝統的な食文化を代表する食べ物であり、ご飯を三角や俵、円柱形などに成形し、海苔で包んだものである、日本のコンビニエンスストアやスーパーマーケットでも手軽に購入することができるのは、何でしょう？,おにぎり,おにぎりは、ご飯を三角、俵、円柱形などに成形し、海苔でつつんだ日本の食べ物です。おにぎりは、日本で古くから今日に至るまで携行食や弁当として重宝されています。現代ではコンビニエンスストアやスーパーマーケットでも販売されるようになっています。
歯,人間の乳歯は大きく乳切歯、乳犬歯、乳臼歯の3歯種に分けることができますが、そのうちで最初に生えるのは何でしょう？,乳切歯,歯（は、英: tooth）は、口腔内にある咀嚼するための一番目の器官。多くの脊椎動物が持つ。人間の乳歯は大きく乳切歯、乳犬歯、乳臼歯の3歯種に分けることができる。
乃木坂46,,,乃木坂46（のぎざかフォーティーシックス、Nogizaka46）は、日本の女性アイドルグループである。秋元康のプロデュースにより、2011年8月21日に結成した。
真珠,貝から採れる宝石の一種で、貝の体内で生成されるものは何でしょう？,真珠,"真珠（しんじゅ）あるいはパール（Pearl）とは、貝から採れる宝石の一種である。真珠は貝の体内で生成される宝石である。真珠（しんじゅ）, パール（Pearl）"
